<?xml version="1.0" encoding="UTF-8"?>
<xs:schema targetNamespace="http://www.w3.org/2001/XMLSchema" elementFormDefault="qualified" xmlns:xs="http://www.w3.org/2001/XMLSchema">
	<xs:element name="librery">
		<xs:complexType>
			<xs:sequence>
				<xs:element name="albums">
					<xs:complexType>
						<xs:sequence>
							<xs:element name="album" maxOccurs="unbounded" minOccurs="0">
								<xs:complexType>
									<xs:simpleContent>
										<xs:extension base="xs:string">
											<xs:attribute type="xs:ID" name="id" use="required"/>
										</xs:extension>
									</xs:simpleContent>
								</xs:complexType>
							</xs:element>
						</xs:sequence>
					</xs:complexType>
				</xs:element>
				<xs:element name="songs">
					<xs:complexType>
						<xs:sequence>
							<xs:element name="song" maxOccurs="unbounded" minOccurs="0">
								<xs:complexType>
									<xs:simpleContent>
										<xs:extension base="xs:string">
											<xs:attribute type="xs:ID" name="id" use="required"/>
										</xs:extension>
									</xs:simpleContent>
								</xs:complexType>
							</xs:element>
						</xs:sequence>
					</xs:complexType>
				</xs:element>
				<xs:element name="album_songs">
					<xs:complexType>
						<xs:sequence>
							<xs:element name="album_song" maxOccurs="unbounded" minOccurs="0">
								<xs:complexType>
									<xs:simpleContent>
										<xs:extension base="xs:string">
											<xs:attribute type="xs:IDREF" name="id_album" use="required"/>
											<xs:attribute type="xs:string" name="id_songs" use="required"/>
										</xs:extension>
									</xs:simpleContent>
								</xs:complexType>
							</xs:element>
						</xs:sequence>
					</xs:complexType>
				</xs:element>
			</xs:sequence>
		</xs:complexType>
	</xs:element>
</xs:schema>